{
  "id": "temple_of_terror",
  "title": "Temple of Terror",
  "description": "Lead a 1970s expedition into a trap-laden tomb in search of a sun idol before curses and collapse claim the party.",
  "entryNode": "River Landing",
  "mapFile": "map_temple_of_terror.json",
  "partySize": 3,
  "nativeArchetypeIDs": [
    "archaeologist",
    "linguist",
    "guide",
    "daredevil",
    "bruiser",
    "mystic"
  ],
  "stressOverflowHarmFamilyID": "mental_fraying"
}
